{
  "id": "e155b741-d860-4449-96ca-092d6430c7e9",
  "kind": "cert",
  "scale": {
    "max": 100,
    "min": 0
  },
  "value": 80,
  "status": "actual",
  "source": {
    "file": "02_audit_logging/reports/ROOT_IMMUNITY_CERTIFICATION_v1.md",
    "hash": "d7dbce9d4c5e082af00ccec521451b74275716a650a5e1447126da300677265bd02d426d5d53394a09a5539397a7cc1cc6c9e224cafeb7a70eb7e07f17151283",
    "line": 38,
    "context": "| **Phase 1: Static Analysis** | 52/100 | 35% | 18.2 pts | PARTIAL |\n| **Phase 2: Dynamic Execution** | 100/100 | 40% | 40.0 pts | PERFECT ‚≠ê |\n| **Phase 3: Audit Proof** | 91/100 | 25% | 22.8 pts | EX"
  },
  "ci": {
    "commit": "a6e6d2a7711cb9b3261c0c624ba2556444e4dc16",
    "run_id": "f84dd0bf-a372-45ed-8554-eacb10baec78",
    "timestamp": "2025-10-16T19:32:36.493341Z"
  },
  "worm": {
    "uuid": "66500c51-3b69-44bb-a3a4-59991a2a603d",
    "signature": "416698d176f570d67d57d32bdea4903afa00baf291075c16023ad53ac35d023992049edcfd7050999265011f38a58e0a6d19e61f3cf3e3d78f24529caa1f3b8f",
    "chain_prev": "c493cb49-a87d-4a1f-9f3a-d36f03f392bc"
  },
  "metadata": {
    "grade": "SILVER",
    "component": "Audit & Compliance"
  }
}