{
  "id": "441ae3e9-438e-4461-8209-0ab20a0b12ab",
  "kind": "cert",
  "scale": {
    "max": 100,
    "min": 0
  },
  "value": 45,
  "status": "actual",
  "source": {
    "file": "02_audit_logging/reports/placeholder_violations_20251014_221849.json",
    "hash": "395e1b7419a2acead0e4bae7ff55a4f8090cc77ced4c32112d2a3c16024235e72627b2466612cbc092a8919da520268be2c793ac74c0b599120dae5ed930b742",
    "line": 57780,
    "context": "      ],\n      \"context_before\": [\n        \"### Before Remediation\",\n        \"- **Score:** 45/100\"\n      ],\n      \"description\": \"TBD placeholder text\",\n      \"file_path\": \"23_compliance\\\\reports\\\\pla"
  },
  "ci": {
    "commit": "a6e6d2a7711cb9b3261c0c624ba2556444e4dc16",
    "run_id": "04974720-32f7-4978-98bb-b36a8b86b9ee",
    "timestamp": "2025-10-16T19:32:20.801865Z"
  },
  "worm": {
    "uuid": "33203979-cc10-4c00-be78-7d064b956502",
    "signature": "62a9e494fcebf0af5aee8ec0a5cb8f170cac24e38865bfca2ac1042d686e283136e36514fdc555ef741e1d76458c8f87b90f57beab7e9d0d61b0cff2bb65665a",
    "chain_prev": "74c68463-544b-4c20-8003-7bcb950f2672"
  },
  "metadata": {
    "component": "Audit & Compliance"
  }
}