{
  "id": "aea1c3e7-d02d-471c-bae4-283c9d72cb61",
  "kind": "cert",
  "scale": {
    "max": 100,
    "min": 0
  },
  "value": 0,
  "status": "actual",
  "source": {
    "file": "02_audit_logging/reports/placeholder_violations_20251014_213022.json",
    "hash": "d0ddb61bc433b3254c428879cab9018fb3044f0bc0256955eda7c687e0c465482e979e4e24a2ae0c59133a6190ffeb176e349765e01de5c79a9a6e782aa8e4e6",
    "line": 54499,
    "context": "    {\n      \"context_after\": [\n        \"- Test Coverage: 95.0/100\",\n        \"- Policy Framework: 100.0/100\"\n      ],\n      \"context_before\": [\n        \"**Breakdown**:\","
  },
  "ci": {
    "commit": "a6e6d2a7711cb9b3261c0c624ba2556444e4dc16",
    "run_id": "0e17b463-24cb-4a37-8cd3-9de0d169fe01",
    "timestamp": "2025-10-16T19:32:04.564463Z"
  },
  "worm": {
    "uuid": "1492ef2d-d7ed-4708-9760-e111ecad6a05",
    "signature": "f984a208519aab44c37f16102955da754d3e497f60b9f79a4e4d536bfc2bb4e987c68ad08da1a606a8a1a96807cb281c3d97305433f55a17f1c22813d4d151d9",
    "chain_prev": "2265bc1d-7191-4f1e-8edd-d07c0d9db58d"
  },
  "metadata": {
    "component": "Audit & Compliance"
  }
}