{
  "id": "2cc73f81-b359-428c-83fd-647dc1280c54",
  "kind": "cert",
  "scale": {
    "max": 100,
    "min": 0
  },
  "value": 0,
  "status": "actual",
  "source": {
    "file": "02_audit_logging/reports/placeholder_violations_20251014_213045.json",
    "hash": "cf1017fccb90069e74d91959d8d1a0170cf222ee8136cd1d63fb55b79be970b0df213d065491c5e7eb0c6b77a470f4f12d5f6dca484293fabad09fd1f736b820",
    "line": 26563,
    "context": "      ],\n      \"context_before\": [\n        \"| **Sealing** | \\u2705 SEALED | SHA-512 |\",\n        \"| **Execution** | \\u274c BLOCKED | 0/100 |\"\n      ],\n      \"description\": \"TBD placeholder text\",\n     "
  },
  "ci": {
    "commit": "a6e6d2a7711cb9b3261c0c624ba2556444e4dc16",
    "run_id": "5b5e9283-917c-404c-a0d7-7f7764316915",
    "timestamp": "2025-10-16T19:32:05.624284Z"
  },
  "worm": {
    "uuid": "6c5e7cb7-a50c-4c1f-8e9f-ec6fbff78393",
    "signature": "e49142deefec7a3b5d4cfe55bafa0d7bd71b6d613e27051d6b2afe05f32054d1d1ab60fabab11867d36c68e29157f509c8ba9e0c01d5d957cf38b6a2f898f54f",
    "chain_prev": "637edde4-7588-4607-8dde-d60bf7ef4bbd"
  },
  "metadata": {
    "component": "Audit & Compliance"
  }
}