{
  "id": "77cdbd73-3b67-45d6-9611-0cffe6451824",
  "kind": "phase",
  "scale": {
    "max": 100,
    "min": 0
  },
  "value": 45,
  "status": "actual",
  "source": {
    "file": "02_audit_logging/reports/placeholder_violations_20251014_214905.json",
    "hash": "b866e9633a6c71f48f9f31a95fb53887dfbd19e245f6a9ddb59cf16ca1f795581c058f011ad3918683895e5b065158089f6030371637824f0737b8ba369e8802",
    "line": 58381,
    "context": "    {\n      \"context_after\": [\n        \"| **After Phase 1** | 35/100 | +15 | Anti-gaming stubs eliminated |\",\n        \"| **After Phase 2** | 45/100 | +10 | Middleware implemented |\"\n      ],\n      \"co"
  },
  "ci": {
    "commit": "a6e6d2a7711cb9b3261c0c624ba2556444e4dc16",
    "run_id": "c0be7de5-13ca-4331-9ee9-de26ad2a577f",
    "timestamp": "2025-10-16T19:32:11.350305Z"
  },
  "worm": {
    "uuid": "1307b994-ea7a-48c8-b2bc-6b51f7dac2e5",
    "signature": "aa58d84ae6e5cca688c213ca9e00efa5167eca40be161a2562d5869710f59f6c818e1d0de1029b0ca3a965a8647621c8aa58c8b08ea84f0ac79e0c35a35dc268",
    "chain_prev": "794ea2be-b065-4a22-adee-a7da4893287c"
  },
  "metadata": {
    "component": "Audit & Compliance"
  }
}