{
  "id": "f2675836-856a-483c-a85c-b8ae84811830",
  "kind": "cert",
  "scale": {
    "max": 100,
    "min": 0
  },
  "value": 38,
  "status": "actual",
  "source": {
    "file": "02_audit_logging/reports/placeholder_violations_20251015_092514.json",
    "hash": "59db072b0fda15c6751f38c947048f73d92e43dcedcd0a247688c748d29e1626dbfb2689cd89d71d3a4d09ba6fb472c1a5d96f08404224209b8abba315c8a846",
    "line": 27328,
    "context": "      ],\n      \"context_before\": [\n        \"1. **Forensic Validation v1-v12** - 94.88/100\",\n        \"   - Gap: Code Authenticity at 74.38/100\"\n      ],\n      \"description\": \"TBD placeholder text\",\n   "
  },
  "ci": {
    "commit": "a6e6d2a7711cb9b3261c0c624ba2556444e4dc16",
    "run_id": "866e7095-a62a-4e3a-af86-e087f73e9110",
    "timestamp": "2025-10-16T19:32:27.997140Z"
  },
  "worm": {
    "uuid": "50148ee3-b649-434a-bf37-8121c71a8269",
    "signature": "8058cffe9590f6e987c0c495dd26a95af9d5b20c8531c2ae88630eabb976dc1b4a63e3d3e3dcdb360d356874d668896870c12d5ff87e0345412dfd483ff6b0e8",
    "chain_prev": "605935f2-4d69-4507-a092-fd8d5b120029"
  },
  "metadata": {
    "label": "Forensic",
    "component": "Audit & Compliance"
  }
}