{
  "id": "92d6cbb2-47eb-48f8-a00b-b22ee6242d91",
  "kind": "cert",
  "scale": {
    "max": 100,
    "min": 0
  },
  "value": 0,
  "status": "actual",
  "source": {
    "file": "02_audit_logging/reports/placeholder_violations_20251014_221912.json",
    "hash": "450bc1b06328cc50c84df0b0e4015879cf73ca7dc2f31f971a125b49c04f2846de0f9037f7515cea4392dd609f9e7c49a20ee72e16af657deaf93d3bd2277b49",
    "line": 54579,
    "context": "    {\n      \"context_after\": [\n        \"- Test Coverage: 95.0/100\",\n        \"- Policy Framework: 100.0/100\"\n      ],\n      \"context_before\": [\n        \"**Breakdown**:\","
  },
  "ci": {
    "commit": "a6e6d2a7711cb9b3261c0c624ba2556444e4dc16",
    "run_id": "3dd5c9ad-d49d-47db-b103-8e67c57c8026",
    "timestamp": "2025-10-16T19:32:22.031770Z"
  },
  "worm": {
    "uuid": "24509523-488a-4687-ad38-d161ea207294",
    "signature": "fc5db84ce59978f2f5652525fc22f75fab13ca6942cb0d7a9a712b3bd5c9e25e31c254169544bece0408b6e67c20bea8016cba939cf7f003698813a4efcf726f",
    "chain_prev": "9ebb6c12-06b3-481e-8779-65b64cb599ab"
  },
  "metadata": {
    "component": "Audit & Compliance"
  }
}