{
  "id": "bb08480c-09d0-423c-ad97-5d7fd35ca40c",
  "kind": "cert",
  "scale": {
    "max": 100,
    "min": 0
  },
  "value": 85,
  "status": "actual",
  "source": {
    "file": "02_audit_logging/reports/placeholder_violations_20251014_213435.json",
    "hash": "6ae66a2a1fe8d9e8d892a73eb480693d7be4a1f59573f07937d0f1ac10aea3127e5eb23c257e65fc11c85e5e320cfa17e38b9e9c2eff195722ba7faf066488e6",
    "line": 56067,
    "context": "    {\n      \"context_after\": [\n        \"- Audit Status: FULLY COMPLIANT (implementation complete)\",\n        \"- Compliance Score: 85/100 (+10 points)\"\n      ],\n      \"context_before\": [\n        \"\","
  },
  "ci": {
    "commit": "a6e6d2a7711cb9b3261c0c624ba2556444e4dc16",
    "run_id": "06376f40-64d9-47dc-8aea-72e721fc71c0",
    "timestamp": "2025-10-16T19:32:08.064603Z"
  },
  "worm": {
    "uuid": "aecd43c2-92d1-4705-905c-fd2c95067b36",
    "signature": "5b66c78e2a438efb576e5ee6b881b7f18f660aa1490457aecbbae22362f62c2d4d4680739eb946dd8c2e0b8a14f5f2f0668222b39a45c654180a05b453fa1b86",
    "chain_prev": "1c65e62f-e2a2-4b9b-8961-c9ae104d7264"
  },
  "metadata": {
    "grade": "SILVER",
    "component": "Audit & Compliance"
  }
}