{
  "id": "92cef1db-4f1f-4e1c-820b-408550306d49",
  "kind": "cert",
  "scale": {
    "max": 100,
    "min": 0
  },
  "value": 100,
  "status": "actual",
  "source": {
    "file": "02_audit_logging/logs/ROOT_24_LOCK_V5_3_COMPLETE_STATUS.md",
    "hash": "c0d29a98d4cde2bf0923517f38d22e6bbc365c2716cf1921e0c70828d9b3e078d2eae4c33fabae8fc2c6cd7c5ccff3e8b5966e1c356eb6ad5b3fb402853958e2",
    "line": 571,
    "context": "---\n\n**üèÜ MAXIMALSTAND ACHIEVED**\n**üîí PERFECT COMPLIANCE 100/100**\n**üì¶ ALL ARTIFACTS COMPLETE & SEALED**\n\n---"
  },
  "ci": {
    "commit": "a6e6d2a7711cb9b3261c0c624ba2556444e4dc16",
    "run_id": "315c80bc-117a-405f-90f1-e19f7db25ce8",
    "timestamp": "2025-10-16T19:32:53.507339Z"
  },
  "worm": {
    "uuid": "e90e1c4a-d5a6-4864-8390-d36564799732",
    "signature": "b276ce41ef5c48a2b10f62e3ce22c9e5c5bf8ba03ea308d7867c2154c134ed1c5458f7eb1c3e254fcf41d64756df12793c805106bc4939ca4352a742363660ed",
    "chain_prev": "f516bf2e-baef-41ef-bc0e-c6cb19996e28"
  },
  "metadata": {
    "grade": "PLATINUM",
    "component": "Audit & Compliance"
  }
}