{
  "id": "56ab53f6-94ee-4140-a79b-ced82ed6c2df",
  "kind": "cert",
  "scale": {
    "max": 100,
    "min": 0
  },
  "value": 31,
  "status": "actual",
  "source": {
    "file": "02_audit_logging/reports/placeholder_violations_20251014_214930.json",
    "hash": "5c130d47475653ffa539b1beb6c59e0059ca9b8975b0b737ca99568fe508759908fcf3a0b7ad34d513d522a114a1a545ec17a919f6e261cba1d3a522d1771dd1",
    "line": 54642,
    "context": "    },\n    {\n      \"context_after\": [\n        \"- \\u2705 **Score Validation:** Average 96.31/100 (governance snapshot: 100/100)\",\n        \"\"\n      ],\n      \"context_before\": ["
  },
  "ci": {
    "commit": "a6e6d2a7711cb9b3261c0c624ba2556444e4dc16",
    "run_id": "446940c4-2cdd-4fd5-845e-41544beeeaf1",
    "timestamp": "2025-10-16T19:32:12.588599Z"
  },
  "worm": {
    "uuid": "96db6aa3-7d39-41fc-a9bb-49412721c806",
    "signature": "29ed5839bcff8a7c3a46dcb749de6138a91a8faffa61987bcc8104001c2d914f918f7bfa5baa4f4cd932f3fe8b81c274fa4c60f8a3645f4ed55d78ed65f9eff4",
    "chain_prev": "bf6481a0-390d-4ee7-a116-4c61f43f1809"
  },
  "metadata": {
    "component": "Audit & Compliance"
  }
}