{
  "id": "47600ae5-ff99-4556-83b4-3724b95fa9e6",
  "kind": "cert",
  "scale": {
    "max": 100,
    "min": 0
  },
  "value": 72,
  "status": "actual",
  "source": {
    "file": "02_audit_logging/reports/placeholder_violations_20251014_215709.json",
    "hash": "a36b47acc6131f0c4c9f7459684f4401b676c92d0294143148773172b0a5a7065eb87818ae5960ed3c78d56cac0d311ed972a13294bb46323849cd1c8bca27da",
    "line": 59669,
    "context": "    },\n    {\n      \"context_after\": [\n        \"- **Compliance Score:** ~72/100 (+5)\",\n        \"\"\n      ],\n      \"context_before\": ["
  },
  "ci": {
    "commit": "a6e6d2a7711cb9b3261c0c624ba2556444e4dc16",
    "run_id": "976ea3ab-9bb0-4748-b96e-792727bb4eb6",
    "timestamp": "2025-10-16T19:32:16.389916Z"
  },
  "worm": {
    "uuid": "6ca60b2e-c3f5-4d15-a5af-553cb232fd56",
    "signature": "742724a85c66c7e185079145f1602b82f704094c24f12112aa85de9de4c55dc9eb18bf71b1fd04d008f19a5113337a9c8dec6bba961d7978ed3c704f0297e236",
    "chain_prev": "a86a6ad7-2a09-485f-91be-81955f5d18f7"
  },
  "metadata": {
    "grade": "BRONZE",
    "component": "Audit & Compliance"
  }
}