{
  "id": "20849fe4-5bb9-4472-894a-54f6da9667fb",
  "kind": "cert",
  "scale": {
    "max": 100,
    "min": 0
  },
  "value": 0,
  "status": "actual",
  "source": {
    "file": "02_audit_logging/reports/placeholder_violations_20251015_091023.json",
    "hash": "465509e93b0339811170824c6f47c3696e24c89dcd58a32d77de7a8f5a560a3ff873e040108f7dcc7c7cbdddf25468239dd2f592de1da21df36d2b26a83c441e",
    "line": 54501,
    "context": "    },\n    {\n      \"context_after\": [\n        \"- Test Coverage: 95.0/100\",\n        \"- Policy Framework: 100.0/100\"\n      ],\n      \"context_before\": ["
  },
  "ci": {
    "commit": "a6e6d2a7711cb9b3261c0c624ba2556444e4dc16",
    "run_id": "e79f9829-5e70-496b-ac15-a271e0521046",
    "timestamp": "2025-10-16T19:32:23.574166Z"
  },
  "worm": {
    "uuid": "c6f02eed-b4f6-4a1e-98ee-bc39acd15e15",
    "signature": "3b09ddd90d635585b22f947ac5cd73558b27731145a7d0947f0b4f99f1ad07343a0f5724a96d40b178e772dd06211bea1ce6a0b14aab531757a1d0104a6f9e30",
    "chain_prev": "b68869df-4eaa-45e2-93b3-920d6e3bd8fc"
  },
  "metadata": {
    "component": "Audit & Compliance"
  }
}