{
  "id": "240b7b1f-9e3d-40ab-99dd-db4b8f0f7f59",
  "kind": "cert",
  "scale": {
    "max": 100,
    "min": 0
  },
  "value": 100,
  "status": "actual",
  "source": {
    "file": "02_audit_logging/reports/placeholder_violations_20251014_213022.json",
    "hash": "d0ddb61bc433b3254c428879cab9018fb3044f0bc0256955eda7c687e0c465482e979e4e24a2ae0c59133a6190ffeb176e349765e01de5c79a9a6e782aa8e4e6",
    "line": 55875,
    "context": "    {\n      \"context_after\": [\n        \"- \\u2705 All 6 dependency edges closed\",\n        \"- \\u2705 **Score: 95-100/100**\"\n      ],\n      \"context_before\": [\n        \"- \\u2705 All 4 regulatory reports "
  },
  "ci": {
    "commit": "a6e6d2a7711cb9b3261c0c624ba2556444e4dc16",
    "run_id": "9a506f9b-b805-42e0-86f7-2b6ded8c7300",
    "timestamp": "2025-10-16T19:32:04.791476Z"
  },
  "worm": {
    "uuid": "fbc69562-6071-4bef-b159-c02521d05673",
    "signature": "b043fbc29993cee50011d963056f2dd7c6f1a70cc6e2ae2d26abe3151e4223d54169b65af7121ecf34632b660815de3eecbdfdad963699f39f11ef4f6b63c3a1",
    "chain_prev": "af4f9b86-2955-426a-b80c-4bf9d05c3522"
  },
  "metadata": {
    "grade": "PLATINUM",
    "component": "Audit & Compliance"
  }
}