{
  "id": "0a0e696a-23da-4a44-a3a2-b82378d73a56",
  "kind": "cert",
  "scale": {
    "max": 100,
    "min": 0
  },
  "value": 94,
  "status": "actual",
  "source": {
    "file": "02_audit_logging/reports/placeholder_violations_20251014_221239.json",
    "hash": "4d542f76085503b251b7a5baad577b06278fa2b29e060973b52914e9c365ce31c56af3e59370f4f941c26926ee7c0b6559c0a7f01315ba24d1c1ec382189c855",
    "line": 29189,
    "context": "    },\n    {\n      \"context_after\": [\n        \"- **Authenticity Score:** 88.94/100\",\n        \"- **Status:** FAIL\"\n      ],\n      \"context_before\": ["
  },
  "ci": {
    "commit": "a6e6d2a7711cb9b3261c0c624ba2556444e4dc16",
    "run_id": "1e19e24c-66a8-43c4-8522-d7e3146c5994",
    "timestamp": "2025-10-16T19:32:18.711158Z"
  },
  "worm": {
    "uuid": "5f6942fb-3f90-4e4c-aaee-4285ecf3ae61",
    "signature": "0739756aba597ed8a0221558c332dec0f65b2eae467006fe55bbf74d0cf3e62b185503af3bb352d0b2830d8d221399575ea2450a32a0c8bc09fb5e3bca511866",
    "chain_prev": "17d70b24-ed65-44c7-a6a0-6996a720661c"
  },
  "metadata": {
    "grade": "GOLD",
    "component": "Audit & Compliance"
  }
}