{
  "id": "97152414-41fd-4167-bb11-f33ee156bfc5",
  "kind": "phase",
  "scale": {
    "max": 100,
    "min": 0
  },
  "value": 45,
  "status": "actual",
  "source": {
    "file": "02_audit_logging/reports/placeholder_violations_20251014_213045.json",
    "hash": "cf1017fccb90069e74d91959d8d1a0170cf222ee8136cd1d63fb55b79be970b0df213d065491c5e7eb0c6b77a470f4f12d5f6dca484293fabad09fd1f736b820",
    "line": 58317,
    "context": "    {\n      \"context_after\": [\n        \"| **After Phase 1** | 35/100 | +15 | Anti-gaming stubs eliminated |\",\n        \"| **After Phase 2** | 45/100 | +10 | Middleware implemented |\"\n      ],\n      \"co"
  },
  "ci": {
    "commit": "a6e6d2a7711cb9b3261c0c624ba2556444e4dc16",
    "run_id": "87bf15a9-2d31-4d09-b4f9-ccec24be2a0c",
    "timestamp": "2025-10-16T19:32:06.584285Z"
  },
  "worm": {
    "uuid": "d3ea37f7-8091-47f1-8fa7-8dcd3a64dfca",
    "signature": "ab5a0940bbe04cbc9c3ff7eddb6ec35b85129e7b6f1b5901e04b4feb2dd0a3a7de7f2ed095b1ed59eadf2f74ad77a17add80b6097125306078e6fb34d2c0e143",
    "chain_prev": "5fb98d8a-29ff-4df8-9ba1-8ec82726368e"
  },
  "metadata": {
    "component": "Audit & Compliance"
  }
}