{
  "id": "87c3d29e-303d-4ebb-9f0b-7b090ee6f983",
  "kind": "cert",
  "scale": {
    "max": 100,
    "min": 0
  },
  "value": 3,
  "status": "actual",
  "source": {
    "file": "02_audit_logging/reports/score_finalization_evidence_20251014.md",
    "hash": "814e39be847c02fb942d8ac6a84d8682afd21938d7f8fc2e8551212b842e43d564e89dc117faabb06396df5703a16ee6e410a952bdf5917f4ab27ad40ddb204c",
    "line": 14,
    "context": "\n### Key Achievements\n\n- ✅ **Overall Score:** 100/100 (up from 87.3/100)\n- ✅ **All Components:** 24/24 modules at 100/100\n- ✅ **All Frameworks:** 6/6 compliance frameworks at 100/100\n- ✅ **External Au"
  },
  "ci": {
    "commit": "a6e6d2a7711cb9b3261c0c624ba2556444e4dc16",
    "run_id": "63fc39d3-bbbc-4796-8315-da8f3c4127d2",
    "timestamp": "2025-10-16T19:32:37.212537Z"
  },
  "worm": {
    "uuid": "4c5af890-0dc3-4f8b-83a7-ed1d46ff9f8a",
    "signature": "bbb2e8cb5bf4306547a26c5382a76bd983009514fb617a8d0f494550a7e6edf3290846530e5102b3887989fbadc8320f7f7f047a00cbac0db971fbe007642f84",
    "chain_prev": "a560f4ab-13ee-4629-a2bb-3e9f75603313"
  },
  "metadata": {
    "component": "Audit & Compliance"
  }
}