{
  "id": "c59b4d3a-246f-40b6-84ff-d818b10bac77",
  "kind": "phase",
  "scale": {
    "max": 100,
    "min": 0
  },
  "value": 83,
  "status": "actual",
  "source": {
    "file": "02_audit_logging/reports/placeholder_violations_20251014_213022.json",
    "hash": "d0ddb61bc433b3254c428879cab9018fb3044f0bc0256955eda7c687e0c465482e979e4e24a2ae0c59133a6190ffeb176e349765e01de5c79a9a6e782aa8e4e6",
    "line": 60370,
    "context": "    },\n    {\n      \"context_after\": [\n        \"+ 80% Coverage:          78-83/100\",\n        \"Sprint 2 Ziel:           85/100\"\n      ],\n      \"context_before\": ["
  },
  "ci": {
    "commit": "a6e6d2a7711cb9b3261c0c624ba2556444e4dc16",
    "run_id": "6320e25b-0a71-44d6-b39a-d5ba99629a9f",
    "timestamp": "2025-10-16T19:32:05.282728Z"
  },
  "worm": {
    "uuid": "4dda897f-e363-4326-985b-4447ecc5c0c2",
    "signature": "5a24ced76e316e2470d33926a4a9ac067903340e85d42c0cf98a5ae933713d2e30b881d325350759d2a3f9819945a34ea4fcd36dc56f22e53ac4782e3e781ed4",
    "chain_prev": "060f7ccd-e4bb-41ff-b696-7e6173200684"
  },
  "metadata": {
    "grade": "SILVER",
    "component": "Audit & Compliance"
  }
}