{
  "id": "8ad6a476-4e09-49f5-9731-785a43f80b24",
  "kind": "cert",
  "scale": {
    "max": 100,
    "min": 0
  },
  "value": 100,
  "status": "actual",
  "source": {
    "file": "02_audit_logging/reports/score_finalization_evidence_20251014.md",
    "hash": "814e39be847c02fb942d8ac6a84d8682afd21938d7f8fc2e8551212b842e43d564e89dc117faabb06396df5703a16ee6e410a952bdf5917f4ab27ad40ddb204c",
    "line": 191,
    "context": "\n### 3.2 eIDAS 2.0 (Electronic Identification & Trust Services)\n- **Status:** COMPLIANT\n- **Score:** 100/100\n- **Components:** Qualified signatures, cross-border recognition, digital wallet\n- **Eviden"
  },
  "ci": {
    "commit": "a6e6d2a7711cb9b3261c0c624ba2556444e4dc16",
    "run_id": "2fd1fa10-cbb9-4e07-a32f-0b06b0018c63",
    "timestamp": "2025-10-16T19:32:37.559903Z"
  },
  "worm": {
    "uuid": "d69c9422-fd0d-4677-837c-d0c7fac7edc7",
    "signature": "d12e90eed8fe45a0d3dbe9fe74ecee617225ffe9cc06b4a68b22e04947aa3f8953643db07c8d7833c6c8dd164178cc9196ad1e558b5280267a72aea2b38656bf",
    "chain_prev": "34cdcaee-08b8-4b15-b3e2-fe279cef4ba0"
  },
  "metadata": {
    "grade": "PLATINUM",
    "component": "Audit & Compliance"
  }
}