{
  "id": "0740050a-3c8a-411d-bc33-c4eabebb9fbc",
  "kind": "cert",
  "scale": {
    "max": 100,
    "min": 0
  },
  "value": 100,
  "status": "actual",
  "source": {
    "file": "02_audit_logging/reports/placeholder_violations_20251014_213458.json",
    "hash": "6e22ec15c688e8926eb23c8195c7eaa116680dc32fbdfef8051442fbf0b00949a28ff43caa75a56c4d26f53e453a4d12e8dba285a0e3d793e549d6247cc1a665",
    "line": 27672,
    "context": "    },\n    {\n      \"context_after\": [\n        \"- [ ] Code Authenticity: 100/100 \\u2713\",\n        \"\"\n      ],\n      \"context_before\": ["
  },
  "ci": {
    "commit": "a6e6d2a7711cb9b3261c0c624ba2556444e4dc16",
    "run_id": "5f775bdf-fa45-4ed9-9ed7-4aab8bb40f94",
    "timestamp": "2025-10-16T19:32:09.074762Z"
  },
  "worm": {
    "uuid": "70321769-e9ae-4aad-aa60-6e9e123ee55b",
    "signature": "5263a9c8686f49b446fbfd59bd28ad8e31100119f58f3c29866d466455e586f66404151ba41c73c1cd9a2986255cfd8cddbfa261d4da4bccb6a45a0a66b95909",
    "chain_prev": "7529a3fd-161e-4235-a48d-d873ce7241f6"
  },
  "metadata": {
    "grade": "PLATINUM",
    "component": "Audit & Compliance"
  }
}