{
  "id": "bafc1b9a-8f99-4f39-a67d-e9f8c443e7e9",
  "kind": "cert",
  "scale": {
    "max": 100,
    "min": 0
  },
  "value": 100,
  "status": "actual",
  "source": {
    "file": "02_audit_logging/reports/placeholder_violations_20251014_214905.json",
    "hash": "b866e9633a6c71f48f9f31a95fb53887dfbd19e245f6a9ddb59cf16ca1f795581c058f011ad3918683895e5b065158089f6030371637824f0737b8ba369e8802",
    "line": 27672,
    "context": "    },\n    {\n      \"context_after\": [\n        \"- [ ] Code Authenticity: 100/100 \\u2713\",\n        \"\"\n      ],\n      \"context_before\": ["
  },
  "ci": {
    "commit": "a6e6d2a7711cb9b3261c0c624ba2556444e4dc16",
    "run_id": "10d7bc2d-e028-4f0b-81d9-bf5140334720",
    "timestamp": "2025-10-16T19:32:10.653109Z"
  },
  "worm": {
    "uuid": "c546d5c5-1068-47bc-b61e-a47615a2f9b5",
    "signature": "8129ffb31d420a681d5b3d9ca34c53ecd7f8a0775951461794f522614c7e4ad5dea05f7b32b7f12157a082c9d67bb3648c75609356b88a5863a38b48ccc687f4",
    "chain_prev": "92f52cd7-0868-4a28-83cc-e52abc799810"
  },
  "metadata": {
    "grade": "PLATINUM",
    "component": "Audit & Compliance"
  }
}