{
  "id": "5836e527-4435-462f-a7ec-8b9b928a0a09",
  "kind": "cert",
  "scale": {
    "max": 100,
    "min": 0
  },
  "value": 75,
  "status": "actual",
  "source": {
    "file": "02_audit_logging/reports/placeholder_violations_20251014_221216.json",
    "hash": "ce5cd5969721cc78b0569fae96f8497ba2b78b545d3dd73204205b95045999a94705afdbc918ac3ae98c11895a164133151cbf0154e7097caae31f8b1f4726e2",
    "line": 59641,
    "context": "        \"- All CI gates passing\"\n      ],\n      \"context_before\": [\n        \"**Minimum Acceptable (75/100):**\",\n        \"- 75% test coverage\"\n      ],\n      \"description\": \"TBD placeholder text\","
  },
  "ci": {
    "commit": "a6e6d2a7711cb9b3261c0c624ba2556444e4dc16",
    "run_id": "2f6d7f37-59a6-4221-86f7-8ba728964531",
    "timestamp": "2025-10-16T19:32:17.907244Z"
  },
  "worm": {
    "uuid": "a976a80f-e284-454b-992f-71d37ca90ee0",
    "signature": "162906fe237948e6b8d318c46373d78152f076f863bedb77733336eb6555235866a3923cb37c3383cb82e2a6b1cbc47c5c69a4c3cf0aea2fdaf9bf69cae4603f",
    "chain_prev": "c81bac49-242d-4f39-86a7-a5f64f8e7a93"
  },
  "metadata": {
    "grade": "BRONZE",
    "component": "Audit & Compliance"
  }
}