{
  "id": "430faa79-03ec-4c16-ba95-a60f39a14e96",
  "kind": "cert",
  "scale": {
    "max": 100,
    "min": 0
  },
  "value": 72,
  "status": "actual",
  "source": {
    "file": "02_audit_logging/reports/placeholder_violations_20251014_215643.json",
    "hash": "e75404288ec176c78dc16a4f222658e09cfcacc91ac42ad155aa3e285c1bfd57850fc8aa18922be3e91d8ecae77034bbd446b191cf520f0236ce26cf09ecc095",
    "line": 59669,
    "context": "    },\n    {\n      \"context_after\": [\n        \"- **Compliance Score:** ~72/100 (+5)\",\n        \"\"\n      ],\n      \"context_before\": ["
  },
  "ci": {
    "commit": "a6e6d2a7711cb9b3261c0c624ba2556444e4dc16",
    "run_id": "de7f2132-2a94-43d9-8a30-dae411a17528",
    "timestamp": "2025-10-16T19:32:14.812506Z"
  },
  "worm": {
    "uuid": "0e7f1113-1225-478a-8cf1-bd53a25c8c1c",
    "signature": "9717337e78653f1878f72e889ac3a21682c7b0c76062325ada95744c044f4e823226dfc13ed440b9e2e823ede7faa7d1466b36e7c38c644a7eb059afc94312db",
    "chain_prev": "cd73f835-195b-4b6a-b9cb-b1e5c533ed15"
  },
  "metadata": {
    "grade": "BRONZE",
    "component": "Audit & Compliance"
  }
}