{
  "id": "4188afa8-a0d6-4df0-a90c-26e2354dba09",
  "kind": "cert",
  "scale": {
    "max": 100,
    "min": 0
  },
  "value": 100,
  "status": "actual",
  "source": {
    "file": "02_audit_logging/reports/fake_integrity_final_verdict.md",
    "hash": "55921e80cb706d35edffde90ac082695baa8c15c036c7671750c0da7394f83e7e1229dafaac21680d844a8d79856e2df15cfcd9f7f0ca5158aeae643b7e29aa9",
    "line": 41,
    "context": "\n### 2. Score Manipulation (36 anomalies) - âœ… FALSE POSITIVE\n\n**Finding:** 36 files with \"100/100\" claims without direct pytest code evidence.\n\n**Investigation Result:** **LEGITIMATE DOCUMENTATION PAT"
  },
  "ci": {
    "commit": "a6e6d2a7711cb9b3261c0c624ba2556444e4dc16",
    "run_id": "71870e4c-e969-467c-8d52-d82e6335c6a0",
    "timestamp": "2025-10-16T19:31:23.794134Z"
  },
  "worm": {
    "uuid": "06636920-ca28-4812-aacf-a5e2b3f4e040",
    "signature": "a48aa7fbe249d9d835abc833059a93ea3f747e87d45711916854dfbafa742e7cfda655d8d13268927387e40c516a7cd4503aeb51d136fd2f78a9c0bf537cad76",
    "chain_prev": "ff4a24b7-1ec4-4862-9e6b-704d8331a734"
  },
  "metadata": {
    "grade": "PLATINUM",
    "component": "Audit & Compliance"
  }
}