{
  "id": "17d56db8-157a-404e-8017-52fc202af8e0",
  "kind": "cert",
  "scale": {
    "max": 100,
    "min": 0
  },
  "value": 100,
  "status": "actual",
  "source": {
    "file": "02_audit_logging/reports/placeholder_violations_20251014_213022.json",
    "hash": "d0ddb61bc433b3254c428879cab9018fb3044f0bc0256955eda7c687e0c465482e979e4e24a2ae0c59133a6190ffeb176e349765e01de5c79a9a6e782aa8e4e6",
    "line": 55367,
    "context": "      ],\n      \"context_before\": [\n        \"|--------|---------|---------|-------|\",\n        \"| Overall Compliance | 100/100 | [TBD] | [TBD] |\"\n      ],\n      \"description\": \"TBD placeholder text\",\n  "
  },
  "ci": {
    "commit": "a6e6d2a7711cb9b3261c0c624ba2556444e4dc16",
    "run_id": "e7ba9072-5b79-42a6-a384-11deaef8e22b",
    "timestamp": "2025-10-16T19:32:04.741481Z"
  },
  "worm": {
    "uuid": "b9b1fdf5-fb40-4e75-a6aa-9197b3a6daad",
    "signature": "3ef85f4076f6770230b78390a466a0dc50b175916606bac1312ad968b41684cb77b3fe8a633d2b4aba059a4706a0a6f2db4540436812ce32fa6be0b385a246f6",
    "chain_prev": "4aff22c0-a4ce-4440-965a-b43504c60f88"
  },
  "metadata": {
    "grade": "PLATINUM",
    "component": "Audit & Compliance"
  }
}